{
  "schema_version": "1.0.0",
  "source": {
    "flippingbook_url": "https://online.flippingbook.com/view/64265310/2/",
    "title": "A la Carte Lunch Kayuputi Menu",
    "total_pages": 5,
    "extraction_method": "FlippingBook searchtext.js text layer + visual/PDF cross-check for page 4",
    "note": "The user-uploaded PDF contained only one rendered page from the full 5-page FlippingBook menu."
  },
  "restaurant": {
    "en": "Kayuputi",
    "zh_hant": "Kayuputi"
  },
  "menu_name": {
    "en": "A la Carte Lunch",
    "zh_hant": "單點午餐餐牌"
  },
  "service_time": "12:00 PM - 3:30 PM",
  "currency": "IDR",
  "tax_and_service": {
    "included_in_listed_prices": true,
    "rate_percent": 21,
    "label": "Prices are inclusive of 21% service charge and government tax",
    "calculation_note": "pre_service_tax_estimate = listed_price / 1.21; included_service_tax_estimate = listed_price - pre_service_tax_estimate",
    "label_zh_hant": "所有標示價格已包含 21% 服務費及政府稅。",
    "label_en": "Prices are inclusive of 21% service charge and government tax"
  },
  "dietary_legend": {
    "V": {
      "en": "Vegetarian",
      "zh_hant": "素食"
    },
    "H": {
      "en": "Healthy",
      "zh_hant": "健康"
    },
    "VG": {
      "en": "Vegan",
      "zh_hant": "純素"
    },
    "GF": {
      "en": "Gluten Free",
      "zh_hant": "無麩質"
    },
    "LC": {
      "en": "Lactose Free",
      "zh_hant": "無乳糖"
    },
    "LS": {
      "en": "Locally Sourced",
      "zh_hant": "本地食材"
    },
    "P": {
      "en": "Pork",
      "zh_hant": "豬肉"
    },
    "N": {
      "en": "Nuts",
      "zh_hant": "含堅果"
    }
  },
  "intro": {
    "en": "Inspired by the Balinese wisdom “Nyegara Gunung” from the mountain to the ocean, Kayuputi showcases Pan-Asian haute cuisine featuring the finest ingredients from the land and the ocean. The culinary creations are complemented by the 16th consecutive year award-winning wine list from prestigious Wine Spectator Award. In a sublime setting of white wood, the restaurant reflects an all white wood décor accented by exemplary Indonesian artifacts while the open kitchen welcomes you to witness our talented chef brigade crafting the gastronomic indulgence against the backdrop of the majestic Indian Ocean. We invite you to embark on the culinary journey from the land to the ocean with us.",
    "zh_hant": "靈感源自峇里智慧「Nyegara Gunung」（由山至海），Kayuputi 以陸地與海洋的上乘食材呈現泛亞洲高級料理。餐廳配備連續第 16 年獲 Wine Spectator Award 肯定的酒單；白木空間、印尼工藝擺設與開放式廚房，配合印度洋景致，邀請你踏上一段由山至海的味覺旅程。"
  },
  "sections": [
    {
      "id": "section-01",
      "name": {
        "en": "Caviar",
        "zh_hant": "魚子醬"
      },
      "page": 2,
      "items": [
        {
          "id": "s01-i01-kristal-caviar",
          "name": {
            "en": "Kristal Caviar",
            "zh_hant": "Kristal 魚子醬"
          },
          "description": {
            "en": "House made buckwheat blinis, boiled free-range eggs, 20gr sour cream and scallion",
            "zh_hant": "自家製蕎麥薄餅、烚走地蛋、20 克酸忌廉及青蔥"
          },
          "dietary_tags": [],
          "price": {
            "amount": 2800000,
            "display": "IDR 2,800,000",
            "pre_service_tax_estimate": 2314049.59,
            "included_service_tax_estimate": 485950.41
          }
        }
      ]
    },
    {
      "id": "section-02",
      "name": {
        "en": "Appetizer",
        "zh_hant": "前菜"
      },
      "page": 2,
      "items": [
        {
          "id": "s02-i01-ahi-tuna",
          "name": {
            "en": "Ahi Tuna",
            "zh_hant": "阿希吞拿魚"
          },
          "description": {
            "en": "Lightly smoked, Sawangan seaweed, coconut, jalapeño, cucumber sorbet",
            "zh_hant": "輕煙燻吞拿魚、Sawangan 海藻、椰子、墨西哥辣椒、青瓜雪葩"
          },
          "dietary_tags": [
            "H",
            "GF",
            "LC",
            "LS"
          ],
          "price": {
            "amount": 340000,
            "display": "IDR 340,000",
            "pre_service_tax_estimate": 280991.74,
            "included_service_tax_estimate": 59008.26
          }
        },
        {
          "id": "s02-i02-sweet-prawn",
          "name": {
            "en": "Sweet Prawn",
            "zh_hant": "甜蝦"
          },
          "description": {
            "en": "Prawn tartare, sweet corn and yuzu kosho, Avruga caviar, shiro dashi vinaigrette",
            "zh_hant": "甜蝦他他、甜粟米與柚子胡椒、Avruga 魚子醬、白出汁油醋汁"
          },
          "dietary_tags": [
            "LC",
            "LS"
          ],
          "price": {
            "amount": 360000,
            "display": "IDR 360,000",
            "pre_service_tax_estimate": 297520.66,
            "included_service_tax_estimate": 62479.34
          }
        },
        {
          "id": "s02-i03-ruby-snapper",
          "name": {
            "en": "Ruby Snapper",
            "zh_hant": "紅鯛魚"
          },
          "description": {
            "en": "Ruby snapper carpaccio, pickled shallot, avocado, ponzu emulsion",
            "zh_hant": "紅鯛魚薄片、醃乾蔥、牛油果、柚子醋乳化醬"
          },
          "dietary_tags": [
            "LC",
            "LS"
          ],
          "price": {
            "amount": 350000,
            "display": "IDR 350,000",
            "pre_service_tax_estimate": 289256.2,
            "included_service_tax_estimate": 60743.8
          }
        },
        {
          "id": "s02-i04-char-grilled-octopus-tentacle",
          "name": {
            "en": "Char-Grilled Octopus Tentacle",
            "zh_hant": "炭烤八爪魚觸鬚"
          },
          "description": {
            "en": "Smoked eggplant, tomato relish, garlic crumbles, herb-spiced virgin coconut oil",
            "zh_hant": "煙燻茄子、番茄 relish、蒜香脆粒、香草香料初榨椰子油"
          },
          "dietary_tags": [
            "LC",
            "LS",
            "GF"
          ],
          "price": {
            "amount": 320000,
            "display": "IDR 320,000",
            "pre_service_tax_estimate": 264462.81,
            "included_service_tax_estimate": 55537.19
          }
        }
      ]
    },
    {
      "id": "section-03",
      "name": {
        "en": "Soup",
        "zh_hant": "湯品"
      },
      "page": 2,
      "items": [
        {
          "id": "s03-i01-lobster",
          "name": {
            "en": "Lobster",
            "zh_hant": "龍蝦湯"
          },
          "description": {
            "en": "Asian flavored lobster consommé, half lobster tail, lobster dumplings, shallot oil",
            "zh_hant": "亞洲風味龍蝦清湯、半隻龍蝦尾、龍蝦餃、乾蔥油"
          },
          "dietary_tags": [
            "LC",
            "LS"
          ],
          "price": {
            "amount": 490000,
            "display": "IDR 490,000",
            "pre_service_tax_estimate": 404958.68,
            "included_service_tax_estimate": 85041.32
          }
        },
        {
          "id": "s03-i02-oxtail",
          "name": {
            "en": "Oxtail",
            "zh_hant": "牛尾湯"
          },
          "description": {
            "en": "Oxtail ragout, celery, carrot, kemangi oil, Archipelago-spiced oxtail broth",
            "zh_hant": "牛尾燉肉、芹菜、甘筍、kemangi 羅勒油、群島香料牛尾湯"
          },
          "dietary_tags": [
            "LC"
          ],
          "price": {
            "amount": 400000,
            "display": "IDR 400,000",
            "pre_service_tax_estimate": 330578.51,
            "included_service_tax_estimate": 69421.49
          }
        }
      ]
    },
    {
      "id": "section-04",
      "name": {
        "en": "Main Course — From the Ocean",
        "zh_hant": "主菜 — 海洋"
      },
      "page": 3,
      "items": [
        {
          "id": "s04-i01-sari-segara",
          "name": {
            "en": "Sari Segara",
            "zh_hant": "Sari Segara 海鮮拼盤"
          },
          "description": {
            "en": "Char-grilled Jimbaran bay seafood, banana blossom, spiced crustacean emulsion, laksa leaf oil",
            "zh_hant": "炭烤金巴蘭灣海鮮、香蕉花、香料甲殼類乳化醬、叻沙葉油"
          },
          "dietary_tags": [
            "LC",
            "GF"
          ],
          "price": {
            "amount": 640000,
            "display": "IDR 640,000",
            "pre_service_tax_estimate": 528925.62,
            "included_service_tax_estimate": 111074.38
          }
        },
        {
          "id": "s04-i02-locally-caught-fish",
          "name": {
            "en": "Locally Caught Fish",
            "zh_hant": "本地捕獲鮮魚"
          },
          "description": {
            "en": "Sautéed vegetables, Asian cress salad, soy and ginger broth",
            "zh_hant": "炒雜菜、亞洲水芹沙律、豉油薑湯"
          },
          "dietary_tags": [
            "LC",
            "LS"
          ],
          "price": {
            "amount": 390000,
            "display": "IDR 390,000",
            "pre_service_tax_estimate": 322314.05,
            "included_service_tax_estimate": 67685.95
          }
        },
        {
          "id": "s04-i03-tasmanian-salmon",
          "name": {
            "en": "Tasmanian Salmon",
            "zh_hant": "塔斯曼尼亞三文魚"
          },
          "description": {
            "en": "Miso cured salmon, zucchini, kemangi oil, bonito-reduction",
            "zh_hant": "味噌醃三文魚、意大利青瓜、kemangi 羅勒油、鰹魚濃縮汁"
          },
          "dietary_tags": [],
          "price": {
            "amount": 460000,
            "display": "IDR 460,000",
            "pre_service_tax_estimate": 380165.29,
            "included_service_tax_estimate": 79834.71
          }
        }
      ]
    },
    {
      "id": "section-05",
      "name": {
        "en": "Main Course — From the Land",
        "zh_hant": "主菜 — 陸地"
      },
      "page": 3,
      "items": [
        {
          "id": "s05-i01-braised-veal-cheek",
          "name": {
            "en": "Braised Veal Cheek",
            "zh_hant": "燉小牛面頰肉"
          },
          "description": {
            "en": "Slow-braised veal, chestnut, cauliflower couscous, vegetable crumbles, truffle sauce",
            "zh_hant": "慢燉小牛肉、栗子、椰菜花 couscous、蔬菜脆粒、松露醬"
          },
          "dietary_tags": [
            "GF",